{
    "contact_url": "https://circleci.com/security/#concerns",
    "hall_of_fame": "",
    "hiring": "",
    "launch_date": "",
    "offers_bounty": "no",
    "offers_swag": true,
    "pgp_key": "",
    "policy_url": "https://circleci.com/security/",
    "policy_url_status": "alive",
    "preferred_languages": "",
    "program_name": "CircleCi",
    "public_disclosure": "",
    "safe_harbor": "none",
    "securitytxt_url": ""
}