{
    "contact_email": "vulnerabilities@avira.com",
    "hall_of_fame": "",
    "hiring": "",
    "launch_date": "",
    "offers_bounty": "yes",
    "offers_swag": false,
    "pgp_key": "",
    "policy_url": "https://www.avira.com/en/support-vulnerability",
    "policy_url_status": "alive",
    "preferred_languages": "",
    "program_name": "Avira",
    "public_disclosure": "",
    "safe_harbor": "none",
    "securitytxt_url": ""
}