{
    "contact_email": "psirt@huawei.com",
    "hall_of_fame": "",
    "hiring": "",
    "launch_date": "",
    "offers_bounty": "no",
    "offers_swag": false,
    "pgp_key": "",
    "policy_url": "https://www.huawei.com/en/psirt/report-vulnerabilities",
    "policy_url_status": "alive",
    "preferred_languages": "",
    "program_name": "Huawei",
    "public_disclosure": "",
    "safe_harbor": "none",
    "securitytxt_url": ""
}