{
    "contact_url": "https://hackerone.com/shieldox_security",
    "hall_of_fame": "",
    "hiring": "",
    "launch_date": "",
    "offers_bounty": "no",
    "offers_swag": false,
    "pgp_key": "",
    "policy_url": "https://hackerone.com/shieldox_security",
    "policy_url_status": "alive",
    "preferred_languages": "",
    "program_name": "Shieldox Security LTD",
    "public_disclosure": "",
    "safe_harbor": "none",
    "securitytxt_url": ""
}