{
    "contact_email": "security@moshbit.com",
    "hall_of_fame": "",
    "hiring": "",
    "launch_date": "",
    "offers_bounty": "yes",
    "offers_swag": false,
    "pgp_key": "",
    "policy_url": "https://studo.com/at/security",
    "policy_url_status": "alive",
    "preferred_languages": "",
    "program_name": "Studo",
    "public_disclosure": "",
    "safe_harbor": "partial",
    "securitytxt_url": ""
}