{
    "contact_url": "https://artifex.com/legal/security/",
    "hall_of_fame": "",
    "hiring": "",
    "launch_date": "",
    "offers_bounty": "yes",
    "offers_swag": false,
    "pgp_key": "",
    "policy_url": "https://ghostscript.com/Bug_bounty_program.html",
    "policy_url_status": "alive",
    "preferred_languages": "",
    "program_name": "Ghostscript",
    "public_disclosure": "",
    "safe_harbor": "none",
    "securitytxt_url": ""
}