{
    "contact_url": "https://issues.jenkins.io/browse/SECURITY",
    "hall_of_fame": "",
    "hiring": "",
    "launch_date": "",
    "offers_bounty": "no",
    "offers_swag": false,
    "pgp_key": "",
    "policy_url": "https://www.jenkins.io/security/reporting/",
    "policy_url_status": "alive",
    "preferred_languages": "",
    "program_name": "Jenkins",
    "public_disclosure": "",
    "safe_harbor": "none",
    "securitytxt_url": ""
}