{
    "contact_email": "security@lookout.com",
    "hall_of_fame": "",
    "hiring": "",
    "launch_date": "",
    "offers_bounty": "no",
    "offers_swag": false,
    "pgp_key": "",
    "policy_url": "https://www.lookout.com/legal/responsible-disclosure",
    "policy_url_status": "alive",
    "preferred_languages": "",
    "program_name": "Lookout",
    "public_disclosure": "",
    "safe_harbor": "partial",
    "securitytxt_url": ""
}