{
    "contact_email": "Support@Gay.Capital",
    "hall_of_fame": "",
    "hiring": "",
    "launch_date": "",
    "offers_bounty": "no",
    "offers_swag": false,
    "pgp_key": "",
    "policy_url": "https://gay.capital/docs/bugbounty",
    "policy_url_status": "alive",
    "preferred_languages": "",
    "program_name": "Gay.Capital",
    "public_disclosure": "",
    "safe_harbor": "full",
    "securitytxt_url": ""
}