{
    "contact_email": "ppbugbounty@paypal.com",
    "hall_of_fame": "",
    "hiring": "",
    "launch_date": "",
    "offers_bounty": "no",
    "offers_swag": false,
    "pgp_key": "",
    "policy_url": "https://www.braintreepayments.com/developers/disclosure",
    "policy_url_status": "alive",
    "preferred_languages": "",
    "program_name": "Braintree",
    "public_disclosure": "",
    "safe_harbor": "none",
    "securitytxt_url": ""
}