{
    "contact_url": "https://hackerone.com/alienvault_security",
    "hall_of_fame": "",
    "hiring": "",
    "launch_date": "",
    "offers_bounty": "no",
    "offers_swag": false,
    "pgp_key": "",
    "policy_url": "https://cybersecurity.att.com/documentation/usm-appliance/system-overview/how-to-submit-a-security-issue-to-alienvault.htm",
    "policy_url_status": "dead",
    "preferred_languages": "",
    "program_name": "Alienvault",
    "public_disclosure": "",
    "safe_harbor": "none",
    "securitytxt_url": ""
}