{
    "contact_email": "beveiliging@independer.nl",
    "hall_of_fame": "",
    "hiring": "",
    "launch_date": "",
    "offers_bounty": "yes",
    "offers_swag": false,
    "pgp_key": "",
    "policy_url": "https://www.independer.nl/algemeen/info/responsible-disclosure.aspx",
    "policy_url_status": "alive",
    "preferred_languages": "",
    "program_name": "Independer",
    "public_disclosure": "",
    "safe_harbor": "partial",
    "securitytxt_url": ""
}