{
    "contact_url": "https://bugcrowd.com/underarmour/report",
    "hall_of_fame": "",
    "hiring": "",
    "launch_date": "",
    "offers_bounty": "no",
    "offers_swag": false,
    "pgp_key": "",
    "policy_url": "https://bugcrowd.com/underarmour",
    "policy_url_status": "alive",
    "preferred_languages": "",
    "program_name": "UNDER ARMOUR",
    "public_disclosure": "",
    "safe_harbor": "partial",
    "securitytxt_url": ""
}