{
    "contact_email": "info@trovisio.com",
    "hall_of_fame": "",
    "hiring": "",
    "launch_date": "",
    "offers_bounty": "no",
    "offers_swag": false,
    "pgp_key": "",
    "policy_url": "https://app.trovisio.com/legal?disclosure=disclosure",
    "policy_url_status": "alive",
    "preferred_languages": "",
    "program_name": "Trovisio",
    "public_disclosure": "",
    "safe_harbor": "none",
    "securitytxt_url": ""
}