{
    "contact_email": "privacyandsecurity@bose.com",
    "hall_of_fame": "",
    "hiring": "",
    "launch_date": "",
    "offers_bounty": "yes",
    "offers_swag": false,
    "pgp_key": "",
    "policy_url": "https://global.bose.com/en_us/product_security_vulnerability_response.html",
    "policy_url_status": "alive",
    "preferred_languages": "",
    "program_name": "Bose",
    "public_disclosure": "",
    "safe_harbor": "partial",
    "securitytxt_url": ""
}