{
    "contact_url": "https://athento.zendesk.com/hc/es/articles/360023151053",
    "hall_of_fame": "",
    "hiring": "",
    "launch_date": "",
    "offers_bounty": "no",
    "offers_swag": false,
    "pgp_key": "",
    "policy_url": "https://athento.zendesk.com/hc/es/articles/360010484720",
    "policy_url_status": "alive",
    "preferred_languages": "",
    "program_name": "Athento",
    "public_disclosure": "",
    "safe_harbor": "none",
    "securitytxt_url": ""
}