{
    "contact_email": "bugbounty@united.com",
    "hall_of_fame": "",
    "hiring": "",
    "launch_date": "",
    "offers_bounty": "yes",
    "offers_swag": false,
    "pgp_key": "",
    "policy_url": "https://www.united.com/web/en-US/content/contact/bugbounty.aspx",
    "policy_url_status": "alive",
    "preferred_languages": "",
    "program_name": "United Airlines",
    "public_disclosure": "",
    "safe_harbor": "none",
    "securitytxt_url": ""
}