{
    "contact_email": "security@internetwache.org",
    "hall_of_fame": "",
    "hiring": "",
    "launch_date": "",
    "offers_bounty": "no",
    "offers_swag": false,
    "pgp_key": "",
    "policy_url": "https://en.internetwache.org/security/",
    "policy_url_status": "alive",
    "preferred_languages": "",
    "program_name": "Internetwache",
    "public_disclosure": "",
    "safe_harbor": "partial",
    "securitytxt_url": ""
}