{
    "contact_url": "https://bugbounty.zoho.com/submit",
    "hall_of_fame": "",
    "hiring": "",
    "launch_date": "",
    "offers_bounty": "yes",
    "offers_swag": false,
    "pgp_key": "",
    "policy_url": "https://bugbounty.zoho.com/bb/info#guide",
    "policy_url_status": "alive",
    "preferred_languages": "",
    "program_name": "Zoho",
    "public_disclosure": "",
    "safe_harbor": "none",
    "securitytxt_url": ""
}