{
    "contact_email": "secalert@datawire.io",
    "hall_of_fame": "",
    "hiring": "",
    "launch_date": "",
    "offers_bounty": "no",
    "offers_swag": true,
    "pgp_key": "",
    "policy_url": "https://blog.getambassador.io/security-in-ambassador-a-risk-based-approach-fd24e364ea84",
    "policy_url_status": "alive",
    "preferred_languages": "",
    "program_name": "GetAmbassador",
    "public_disclosure": "",
    "safe_harbor": "partial",
    "securitytxt_url": ""
}