{
    "contact_email": "security@chargify.com",
    "hall_of_fame": "",
    "hiring": "",
    "launch_date": "",
    "offers_bounty": "no",
    "offers_swag": false,
    "pgp_key": "",
    "policy_url": "https://www.chargify.com/security/",
    "policy_url_status": "alive",
    "preferred_languages": "",
    "program_name": "Chargify",
    "public_disclosure": "",
    "safe_harbor": "none",
    "securitytxt_url": ""
}